{
  "schema_version": 1,
  "workflow_id": "WF-00000000-0000-0000-0000-000000000000",
  "task_id": "TASK-00000000-0000-0000-0000-000000000000",
  "run_id": "RUN-00000000-0000-0000-0000-000000000000",
  "parent_task_id": null,
  "task_type": "DEVELOPMENT",
  "assigned_agent": "developer-agent",
  "title": "<PLACEHOLDER: 任务标题>",
  "description": "<PLACEHOLDER: 任务详细描述，供被指派的工作 Agent 阅读>",
  "status": "READY",
  "dependencies": [],
  "acceptance_criteria_ids": [
    "AC-001"
  ],
  "attempt": 1,
  "max_attempts": 3,
  "input_commit": "PLACEHOLDER_INPUT_COMMIT_SHA",
  "expected_branch": "sdlc/task/TASK-00000000-0000-0000-0000-000000000000",
  "worktree_path_abs": "C:\\path\\to\\openclaw-runtime\\worktrees\\developer-agent",
  "artifact_root_abs": "C:\\path\\to\\openclaw-runtime\\artifacts\\TASK-00000000-0000-0000-0000-000000000000\\RUN-00000000-0000-0000-0000-000000000000",
  "context_manifest_path_abs": "C:\\path\\to\\openclaw-runtime\\artifacts\\TASK-00000000-0000-0000-0000-000000000000\\RUN-00000000-0000-0000-0000-000000000000\\context-manifest.json",
  "allowed_write_paths_abs": [
    "C:\\path\\to\\openclaw-runtime\\worktrees\\developer-agent\\src",
    "C:\\path\\to\\openclaw-runtime\\artifacts\\TASK-00000000-0000-0000-0000-000000000000\\RUN-00000000-0000-0000-0000-000000000000"
  ],
  "forbidden_paths_abs": [
    "C:\\path\\to\\target-project\\.git",
    "C:\\path\\to\\openclaw-runtime\\worktrees\\review-agent",
    "C:\\path\\to\\openclaw-runtime\\worktrees\\test-agent"
  ],
  "required_outputs": [
    "C:\\path\\to\\openclaw-runtime\\artifacts\\TASK-00000000-0000-0000-0000-000000000000\\RUN-00000000-0000-0000-0000-000000000000\\development-report.md"
  ],
  "approval_dependencies": [
    "DEC-00000000-0000-0000-0000-000000000000"
  ],
  "created_at": "2026-01-01T00:00:00Z",
  "updated_at": "2026-01-01T00:00:00Z"
}
